IssueID	Category	SpecificIssue	ExpandedDescription	AcceptanceCriteria	Test	Solution1	Solution2	Solution3	Solution4	Effort
161	Bootstrap 3.3.6 Specific	Images in Suggested result no alt text (WCAG 1.1.1)	Search suggestion results in ServiceNow Service Portal display images without proper alt text, violating WCAG 1.1.1. Screen reader users receive no context about the suggested items, leading to poor navigation in search features.,	All images in search suggestions have descriptive alt text or are marked decorative with aria-hidden.,	Run search in litmus widget or real portal, inspect suggestions with axe-core; confirm no missing alt violations.,	Add alt text via widget templates in core-overrides.,	CSS fallback with aria-label for suggestion images.,	a11y.scss rule enforcing alt on search images.,	Theme search widget standardization.,	Medium
162	Bootstrap 3.3.6 Specific	Search results images no defined names (WCAG 1.1.1)	Search result images lack accessible names (alt or aria-label), violating WCAG 1.1.1. Screen readers announce generic or no information for result thumbnails.,	Every search result image has a meaningful accessible name.,	Perform search and inspect results with screen reader; confirm proper announcement.,	Override search result image templates with alt in core-overrides.,	CSS + aria-label fallback.,	a11y.scss enforcement for search images.,	Theme search component update.,	Low
163	Bootstrap 3.3.6 Specific	Action menu decorative image in name (WCAG 1.1.1)	Action menu icons are included in accessible name without being marked decorative, causing screen readers to announce irrelevant icon descriptions in lists and tables.,	Decorative action menu images are properly hidden from screen readers.,	Inspect action menus in litmus widget; confirm icons are silent to screen readers.,	Add aria-hidden to action menu icons in core-overrides.,	CSS rule for decorative menu items.,	a11y.scss block for menus.,	Theme list action standardization.,	Low
164	Bootstrap 3.3.6 Specific	Cloud icon focusable (WCAG 1.1.1)	The cloud icon (loading or status) is focusable but has no purpose or label, violating WCAG 1.1.1 and 2.4.7.,	Non-interactive cloud icons are not focusable and have proper aria-hidden.,	Tab through page with loading states; confirm cloud icon is skipped.,	Add tabindex="-1" and aria-hidden to cloud icons in core-overrides.,	CSS rule for status icons.,	a11y.scss enforcement.,	Theme global icon fixes.,	Low
165	Bootstrap 3.3.6 Specific	Remove from Wishlist heading level 1 (WCAG 1.3.1)	"Remove from Wishlist" text uses heading level 1 incorrectly in catalog, violating WCAG 1.3.1 heading hierarchy.,	All headings follow proper hierarchy; no misuse of h1.,	Inspect wishlist section in litmus or catalog; confirm heading levels are correct.,	Change to appropriate heading level in widget templates in core-overrides.,	CSS styling for correct headings.,	a11y.scss rule for heading validation.,	Theme catalog widget update.,	Low
166	Bootstrap 3.3.6 Specific	Radio group in Thanks dialog no association (WCAG 1.3.1)	Radio buttons in "Thanks" dialog lack proper grouping and labels, violating WCAG 1.3.1.,	Radio groups have fieldset/legend and associated labels.,	Open thanks dialog and inspect with axe-core; confirm grouping passes.,	Add fieldset/legend in dialog templates in core-overrides.,	CSS for group styling.,	a11y.scss enforcement.,	Theme dialog standardization.,	Low
167	Bootstrap 3.3.6 Specific	Required fields no required attribute (WCAG 1.3.1)	Required fields in forms lack aria-required or HTML5 required, violating WCAG 1.3.1.,	All required fields have aria-required="true" and visible indicator.,	Inspect forms in litmus widget; confirm required attributes present.,	Add aria-required to form fields in core-overrides.,	CSS var for required styling.,	a11y.scss rule.,	Theme form template update.,	Low
168	Bootstrap 3.3.6 Specific	All headings level 4 on status page (WCAG 1.3.1)	Status page uses multiple h4 headings without proper hierarchy, violating WCAG 1.3.1.,	Headings follow logical hierarchy (h1-h6).,	Inspect status page; confirm proper heading structure.,	Update heading levels in status widget templates in core-overrides.,	CSS for heading styles.,	a11y.scss heading enforcement.,	Theme status page standardization.,	Low
169	Bootstrap 3.3.6 Specific	Verbose add attachment description (WCAG 1.3.1)	"Add Attachment" button has verbose, redundant description read by screen readers, violating WCAG 1.3.1.,	Button accessible name is concise and clear.,	Inspect attachment button with screen reader; confirm concise name.,	Simplify accessible name in core-overrides templates.,	CSS for button text.,	a11y.scss rule.,	Theme attachment widget update.,	Low
170	Bootstrap 3.3.6 Specific	Reset Password steps no list formatting (WCAG 1.3.1)	Reset password steps are not marked as ordered or unordered list, violating WCAG 1.3.1.,	Steps are properly marked as <ol> or <ul> with correct roles.,	Inspect reset password page; confirm list structure.,	Update steps to list markup in core-overrides.,	CSS for list styling.,	a11y.scss enforcement.,	Theme password reset standardization.,	Low
171	Bootstrap 3.3.6 Specific	? and checkmark announced twice (WCAG 1.3.1)	Question mark and checkmark icons are announced twice by screen readers due to duplicate text + icon, violating WCAG 1.3.1.,	Icons have single concise announcement or are hidden if decorative.,	Inspect icons with screen reader; confirm no duplicate announcements.,	Add aria-hidden to redundant icons in core-overrides.,	CSS rule for icon hiding.,	a11y.scss block.,	Theme icon standardization.,	Low
172	Bootstrap 3.3.6 Specific	Legend heading no markup (WCAG 1.3.1)	Legend text in forms is not marked as heading or proper label, violating WCAG 1.3.1.,	Legend text uses appropriate heading or label markup.,	Inspect forms with legends; confirm proper structure.,	Update legend markup in core-overrides.,	CSS for legend styling.,	a11y.scss enforcement.,	Theme form templates.,	Low
173	Bootstrap 3.3.6 Specific	Date/time grouping announced thrice (WCAG 1.3.1)	Date/time fields announce grouping three times due to redundant labels, violating WCAG 1.3.1.,	Date/time groups announce once with clear context.,	Inspect date/time fields with screen reader; confirm single announcement.,	Simplify grouping markup in core-overrides.,	CSS for field grouping.,	a11y.scss rule.,	Theme date/time widget update.,	Low
174	Bootstrap 3.3.6 Specific	Unnecessary list on attachment button (WCAG 1.3.1)	Attachment button is wrapped in unnecessary list markup, violating WCAG 1.3.1.,	Attachment buttons have clean non-list structure.,	Inspect attachment button; confirm no unnecessary list.,	Remove list wrapper in core-overrides templates.,	CSS for button.,	a11y.scss enforcement.,	Theme attachment component.,	Low
175	Bootstrap 3.3.6 Specific	Tooltip not announced (WCAG 1.3.1)	Tooltips on hover/focus are not announced to screen readers, violating WCAG 1.3.1.,	Tooltips use aria-describedby or proper role for announcement.,	Hover/focus on tooltip elements; confirm announcement.,	Add aria-describedby to tooltip triggers in core-overrides.,	CSS for tooltip visibility.,	a11y.scss tooltip ARIA block.,	Theme tooltip standardization.,	Medium
176	Bootstrap 3.3.6 Specific	Dismiss X announced twice (WCAG 1.3.1)	Modal dismiss "X" button is announced twice due to duplicate text/icon, violating WCAG 1.3.1.,	Dismiss button has single clear accessible name.,	Open modal and inspect close button with screen reader; confirm single announcement.,	Simplify dismiss button markup in core-overrides.,	CSS for close button.,	a11y.scss rule.,	Theme modal component.,	Low
177	Bootstrap 3.3.6 Specific	Record link multiple references (WCAG 1.3.1)	Record links have multiple redundant references in accessible name, violating WCAG 1.3.1.,	Record links have concise unique accessible names.,	Inspect record links; confirm clean name.,	Clean accessible name in core-overrides templates.,	CSS for links.,	a11y.scss enforcement.,	Theme list/record link update.,	Low
178	Bootstrap 3.3.6 Specific	Search icon announced thrice (WCAG 1.3.1)	Search icon is announced three times due to redundant text/icon/title, violating WCAG 1.3.1.,	Search icon has single concise announcement or is hidden.,	Inspect search icon with screen reader; confirm single announcement.,	Simplify search icon markup in core-overrides.,	CSS for icon.,	a11y.scss rule.,	Theme search component.,	Low
179	Bootstrap 3.3.6 Specific	Article metadata not meaningful (WCAG 1.3.1)	Knowledge article metadata is not marked with proper headings or labels, violating WCAG 1.3.1.,	Article metadata uses semantic headings and labels.,	Inspect knowledge article; confirm meaningful structure.,	Update metadata markup in core-overrides.,	CSS for metadata.,	a11y.scss enforcement.,	Theme knowledge article template.,	Low
180	Bootstrap 3.3.6 Specific	Metadata bypassed by screen reader (WCAG 1.3.1)	Some metadata is bypassed or not announced by screen readers due to improper markup, violating WCAG 1.3.1.,	All metadata is properly announced with correct roles.,	Inspect metadata sections with screen reader; confirm full announcement.,	Fix markup in core-overrides templates.,	CSS for visibility.,	a11y.scss block.,	Theme metadata standardization.,	Low